CREATE TABLE IF NOT EXISTS mysql.server_audit_filters (
filtername char(80) COLLATE utf8_bin NOT NULL DEFAULT '',
rule longtext CHARACTER SET utf8mb4 COLLATE utf8mb4_bin NOT NULL DEFAULT 'true' CHECK (json_valid(rule)),
CONSTRAINT c_filtername UNIQUE (filtername)
) ENGINE=Aria;
CREATE TABLE IF NOT EXISTS mysql.server_audit_users (host char(60) COLLATE utf8_bin NOT NULL DEFAULT '',
user char(80) COLLATE utf8_bin NOT NULL DEFAULT '',
filtername char(80) NOT NULL DEFAULT '',
CONSTRAINT c_host_user UNIQUE (host, user)
) ENGINE=Aria;
install plugin server_audit soname 'server_audit2';
show variables like 'server_audit%';
Variable_name	Value
server_audit_file_path	server_audit.log
server_audit_file_rotate_now	OFF
server_audit_file_rotate_size	1000000
server_audit_file_rotations	9
server_audit_logging	OFF
server_audit_mode	0
server_audit_output_type	file
server_audit_query_log_limit	1024
server_audit_reload_filters	OFF
server_audit_syslog_facility	LOG_USER
server_audit_syslog_ident	mysql-server_auditing
server_audit_syslog_info	
server_audit_syslog_priority	LOG_INFO
INSERT INTO mysql.server_audit_filters VALUES ('default','{"logging" : "off"}');
INSERT INTO mysql.server_audit_filters VALUES ('table_all','{"table_event" : "ALL"}');
INSERT INTO mysql.server_audit_filters VALUES ('table_read','{"table_event" : "READ"}');
INSERT INTO mysql.server_audit_filters VALUES ('table_write','{"table_event" : "WRITE"}');
INSERT INTO mysql.server_audit_filters VALUES ('table_create','{"table_event" : "CREATE"}');
INSERT INTO mysql.server_audit_filters VALUES ('table_alter','{"table_event" : "ALTER"}');
INSERT INTO mysql.server_audit_filters VALUES ('table_rename','{"table_event" : "RENAME"}');
INSERT INTO mysql.server_audit_filters VALUES ('table_drop','{"table_event" : "DROP"}');
INSERT INTO mysql.server_audit_filters VALUES ('table_combined','{"table_event" : ["WRITE","CREATE"]}');
SET GLOBAL server_audit_logging=on;
INSERT INTO mysql.server_audit_users VALUES ('%','root','table_all');
SET GLOBAL server_audit_reload_filters=ON;
SHOW STATUS LIKE "Server_audit_session_filter";
Variable_name	Value
Server_audit_session_filter	table_all
connect  con1,localhost,root,,mysql;
connection default;
disconnect con1;
connect(localhost,root,wrong_pwd,mysql,MASTER_PORT,MASTER_SOCKET);
connect  con1,localhost,root,wrong_pwd,mysql;
ERROR 28000: Access denied for user 'root'@'localhost' (using password: YES)
connection default;
connect(localhost,no_such_user,,mysql,MASTER_PORT,MASTER_SOCKET);
connect  con1,localhost,no_such_user,,mysql;
ERROR 28000: Access denied for user 'no_such_user'@'localhost' (using password: NO)
connection default;
CREATE DATABASE d1;
CREATE TABLE d1.t1 (id int);
INSERT INTO d1.t1 VALUES (1);
SELECT * from d1.t1;
id
1
UPDATE d1.t1 SET id=2;
DELETE FROM d1.t1;
ALTER TABLE d1.t1 ADD COLUMN (id2 int);
RENAME TABLE d1.t1 to d1.t2;
DROP TABLE d1.t2;
DROP DATABASE d1;
CREATE USER u1 IDENTIFIED BY 'pwd-123';
GRANT ALL ON *.* TO u1 IDENTIFIED BY "pwd-321";
SET PASSWORD FOR u1 = PASSWORD('pwd 098');
drop user u1;
select * from test.t_doesnt_exist;
ERROR 42S02: Table 'test.t_doesnt_exist' doesn't exist
syntax_error_query;
ERROR 42000: You have an error in your SQL syntax; check the manual that corresponds to your MariaDB server version for the right syntax to use near 'syntax_error_query' at line 1
UPDATE mysql.server_audit_users SET filtername= 'table_read' where host='%' and user='root';
SET GLOBAL server_audit_reload_filters=ON;
SHOW STATUS LIKE "Server_audit_session_filter";
Variable_name	Value
Server_audit_session_filter	table_read
connect  con1,localhost,root,,mysql;
connection default;
disconnect con1;
connect(localhost,root,wrong_pwd,mysql,MASTER_PORT,MASTER_SOCKET);
connect  con1,localhost,root,wrong_pwd,mysql;
ERROR 28000: Access denied for user 'root'@'localhost' (using password: YES)
connection default;
connect(localhost,no_such_user,,mysql,MASTER_PORT,MASTER_SOCKET);
connect  con1,localhost,no_such_user,,mysql;
ERROR 28000: Access denied for user 'no_such_user'@'localhost' (using password: NO)
connection default;
CREATE DATABASE d1;
CREATE TABLE d1.t1 (id int);
INSERT INTO d1.t1 VALUES (1);
SELECT * from d1.t1;
id
1
UPDATE d1.t1 SET id=2;
DELETE FROM d1.t1;
ALTER TABLE d1.t1 ADD COLUMN (id2 int);
RENAME TABLE d1.t1 to d1.t2;
DROP TABLE d1.t2;
DROP DATABASE d1;
CREATE USER u1 IDENTIFIED BY 'pwd-123';
GRANT ALL ON *.* TO u1 IDENTIFIED BY "pwd-321";
SET PASSWORD FOR u1 = PASSWORD('pwd 098');
drop user u1;
select * from test.t_doesnt_exist;
ERROR 42S02: Table 'test.t_doesnt_exist' doesn't exist
syntax_error_query;
ERROR 42000: You have an error in your SQL syntax; check the manual that corresponds to your MariaDB server version for the right syntax to use near 'syntax_error_query' at line 1
UPDATE mysql.server_audit_users SET filtername= 'table_write' where host='%' and user='root';
SET GLOBAL server_audit_reload_filters=ON;
SHOW STATUS LIKE "Server_audit_session_filter";
Variable_name	Value
Server_audit_session_filter	table_write
connect  con1,localhost,root,,mysql;
connection default;
disconnect con1;
connect(localhost,root,wrong_pwd,mysql,MASTER_PORT,MASTER_SOCKET);
connect  con1,localhost,root,wrong_pwd,mysql;
ERROR 28000: Access denied for user 'root'@'localhost' (using password: YES)
connection default;
connect(localhost,no_such_user,,mysql,MASTER_PORT,MASTER_SOCKET);
connect  con1,localhost,no_such_user,,mysql;
ERROR 28000: Access denied for user 'no_such_user'@'localhost' (using password: NO)
connection default;
CREATE DATABASE d1;
CREATE TABLE d1.t1 (id int);
INSERT INTO d1.t1 VALUES (1);
SELECT * from d1.t1;
id
1
UPDATE d1.t1 SET id=2;
DELETE FROM d1.t1;
ALTER TABLE d1.t1 ADD COLUMN (id2 int);
RENAME TABLE d1.t1 to d1.t2;
DROP TABLE d1.t2;
DROP DATABASE d1;
CREATE USER u1 IDENTIFIED BY 'pwd-123';
GRANT ALL ON *.* TO u1 IDENTIFIED BY "pwd-321";
SET PASSWORD FOR u1 = PASSWORD('pwd 098');
drop user u1;
select * from test.t_doesnt_exist;
ERROR 42S02: Table 'test.t_doesnt_exist' doesn't exist
syntax_error_query;
ERROR 42000: You have an error in your SQL syntax; check the manual that corresponds to your MariaDB server version for the right syntax to use near 'syntax_error_query' at line 1
UPDATE mysql.server_audit_users SET filtername= 'table_create' where host='%' and user='root';
SET GLOBAL server_audit_reload_filters=ON;
SHOW STATUS LIKE "Server_audit_session_filter";
Variable_name	Value
Server_audit_session_filter	table_create
connect  con1,localhost,root,,mysql;
connection default;
disconnect con1;
connect(localhost,root,wrong_pwd,mysql,MASTER_PORT,MASTER_SOCKET);
connect  con1,localhost,root,wrong_pwd,mysql;
ERROR 28000: Access denied for user 'root'@'localhost' (using password: YES)
connection default;
connect(localhost,no_such_user,,mysql,MASTER_PORT,MASTER_SOCKET);
connect  con1,localhost,no_such_user,,mysql;
ERROR 28000: Access denied for user 'no_such_user'@'localhost' (using password: NO)
connection default;
CREATE DATABASE d1;
CREATE TABLE d1.t1 (id int);
INSERT INTO d1.t1 VALUES (1);
SELECT * from d1.t1;
id
1
UPDATE d1.t1 SET id=2;
DELETE FROM d1.t1;
ALTER TABLE d1.t1 ADD COLUMN (id2 int);
RENAME TABLE d1.t1 to d1.t2;
DROP TABLE d1.t2;
DROP DATABASE d1;
CREATE USER u1 IDENTIFIED BY 'pwd-123';
GRANT ALL ON *.* TO u1 IDENTIFIED BY "pwd-321";
SET PASSWORD FOR u1 = PASSWORD('pwd 098');
drop user u1;
select * from test.t_doesnt_exist;
ERROR 42S02: Table 'test.t_doesnt_exist' doesn't exist
syntax_error_query;
ERROR 42000: You have an error in your SQL syntax; check the manual that corresponds to your MariaDB server version for the right syntax to use near 'syntax_error_query' at line 1
UPDATE mysql.server_audit_users SET filtername= 'table_alter' where host='%' and user='root';
SET GLOBAL server_audit_reload_filters=ON;
SHOW STATUS LIKE "Server_audit_session_filter";
Variable_name	Value
Server_audit_session_filter	table_alter
connect  con1,localhost,root,,mysql;
connection default;
disconnect con1;
connect(localhost,root,wrong_pwd,mysql,MASTER_PORT,MASTER_SOCKET);
connect  con1,localhost,root,wrong_pwd,mysql;
ERROR 28000: Access denied for user 'root'@'localhost' (using password: YES)
connection default;
connect(localhost,no_such_user,,mysql,MASTER_PORT,MASTER_SOCKET);
connect  con1,localhost,no_such_user,,mysql;
ERROR 28000: Access denied for user 'no_such_user'@'localhost' (using password: NO)
connection default;
CREATE DATABASE d1;
CREATE TABLE d1.t1 (id int);
INSERT INTO d1.t1 VALUES (1);
SELECT * from d1.t1;
id
1
UPDATE d1.t1 SET id=2;
DELETE FROM d1.t1;
ALTER TABLE d1.t1 ADD COLUMN (id2 int);
RENAME TABLE d1.t1 to d1.t2;
DROP TABLE d1.t2;
DROP DATABASE d1;
CREATE USER u1 IDENTIFIED BY 'pwd-123';
GRANT ALL ON *.* TO u1 IDENTIFIED BY "pwd-321";
SET PASSWORD FOR u1 = PASSWORD('pwd 098');
drop user u1;
select * from test.t_doesnt_exist;
ERROR 42S02: Table 'test.t_doesnt_exist' doesn't exist
syntax_error_query;
ERROR 42000: You have an error in your SQL syntax; check the manual that corresponds to your MariaDB server version for the right syntax to use near 'syntax_error_query' at line 1
UPDATE mysql.server_audit_users SET filtername= 'table_rename' where host='%' and user='root';
SET GLOBAL server_audit_reload_filters=ON;
SHOW STATUS LIKE "Server_audit_session_filter";
Variable_name	Value
Server_audit_session_filter	table_rename
connect  con1,localhost,root,,mysql;
connection default;
disconnect con1;
connect(localhost,root,wrong_pwd,mysql,MASTER_PORT,MASTER_SOCKET);
connect  con1,localhost,root,wrong_pwd,mysql;
ERROR 28000: Access denied for user 'root'@'localhost' (using password: YES)
connection default;
connect(localhost,no_such_user,,mysql,MASTER_PORT,MASTER_SOCKET);
connect  con1,localhost,no_such_user,,mysql;
ERROR 28000: Access denied for user 'no_such_user'@'localhost' (using password: NO)
connection default;
CREATE DATABASE d1;
CREATE TABLE d1.t1 (id int);
INSERT INTO d1.t1 VALUES (1);
SELECT * from d1.t1;
id
1
UPDATE d1.t1 SET id=2;
DELETE FROM d1.t1;
ALTER TABLE d1.t1 ADD COLUMN (id2 int);
RENAME TABLE d1.t1 to d1.t2;
DROP TABLE d1.t2;
DROP DATABASE d1;
CREATE USER u1 IDENTIFIED BY 'pwd-123';
GRANT ALL ON *.* TO u1 IDENTIFIED BY "pwd-321";
SET PASSWORD FOR u1 = PASSWORD('pwd 098');
drop user u1;
select * from test.t_doesnt_exist;
ERROR 42S02: Table 'test.t_doesnt_exist' doesn't exist
syntax_error_query;
ERROR 42000: You have an error in your SQL syntax; check the manual that corresponds to your MariaDB server version for the right syntax to use near 'syntax_error_query' at line 1
UPDATE mysql.server_audit_users SET filtername= 'table_drop' where host='%' and user='root';
SET GLOBAL server_audit_reload_filters=ON;
SHOW STATUS LIKE "Server_audit_session_filter";
Variable_name	Value
Server_audit_session_filter	table_drop
connect  con1,localhost,root,,mysql;
connection default;
disconnect con1;
connect(localhost,root,wrong_pwd,mysql,MASTER_PORT,MASTER_SOCKET);
connect  con1,localhost,root,wrong_pwd,mysql;
ERROR 28000: Access denied for user 'root'@'localhost' (using password: YES)
connection default;
connect(localhost,no_such_user,,mysql,MASTER_PORT,MASTER_SOCKET);
connect  con1,localhost,no_such_user,,mysql;
ERROR 28000: Access denied for user 'no_such_user'@'localhost' (using password: NO)
connection default;
CREATE DATABASE d1;
CREATE TABLE d1.t1 (id int);
INSERT INTO d1.t1 VALUES (1);
SELECT * from d1.t1;
id
1
UPDATE d1.t1 SET id=2;
DELETE FROM d1.t1;
ALTER TABLE d1.t1 ADD COLUMN (id2 int);
RENAME TABLE d1.t1 to d1.t2;
DROP TABLE d1.t2;
DROP DATABASE d1;
CREATE USER u1 IDENTIFIED BY 'pwd-123';
GRANT ALL ON *.* TO u1 IDENTIFIED BY "pwd-321";
SET PASSWORD FOR u1 = PASSWORD('pwd 098');
drop user u1;
select * from test.t_doesnt_exist;
ERROR 42S02: Table 'test.t_doesnt_exist' doesn't exist
syntax_error_query;
ERROR 42000: You have an error in your SQL syntax; check the manual that corresponds to your MariaDB server version for the right syntax to use near 'syntax_error_query' at line 1
UPDATE mysql.server_audit_users SET filtername= 'table_combined' where host='%' and user='root';
SET GLOBAL server_audit_reload_filters=ON;
SHOW STATUS LIKE "Server_audit_session_filter";
Variable_name	Value
Server_audit_session_filter	table_combined
connect  con1,localhost,root,,mysql;
connection default;
disconnect con1;
connect(localhost,root,wrong_pwd,mysql,MASTER_PORT,MASTER_SOCKET);
connect  con1,localhost,root,wrong_pwd,mysql;
ERROR 28000: Access denied for user 'root'@'localhost' (using password: YES)
connection default;
connect(localhost,no_such_user,,mysql,MASTER_PORT,MASTER_SOCKET);
connect  con1,localhost,no_such_user,,mysql;
ERROR 28000: Access denied for user 'no_such_user'@'localhost' (using password: NO)
connection default;
CREATE DATABASE d1;
CREATE TABLE d1.t1 (id int);
INSERT INTO d1.t1 VALUES (1);
SELECT * from d1.t1;
id
1
UPDATE d1.t1 SET id=2;
DELETE FROM d1.t1;
ALTER TABLE d1.t1 ADD COLUMN (id2 int);
RENAME TABLE d1.t1 to d1.t2;
DROP TABLE d1.t2;
DROP DATABASE d1;
CREATE USER u1 IDENTIFIED BY 'pwd-123';
GRANT ALL ON *.* TO u1 IDENTIFIED BY "pwd-321";
SET PASSWORD FOR u1 = PASSWORD('pwd 098');
drop user u1;
select * from test.t_doesnt_exist;
ERROR 42S02: Table 'test.t_doesnt_exist' doesn't exist
syntax_error_query;
ERROR 42000: You have an error in your SQL syntax; check the manual that corresponds to your MariaDB server version for the right syntax to use near 'syntax_error_query' at line 1
uninstall plugin server_audit;
Warnings:
Warning	1620	Plugin is busy and will be uninstalled on shutdown
truncate mysql.server_audit_filters;
truncate mysql.server_audit_users;
TIME,HOSTNAME,,,0,0,AUDIT_CONFIG,,file_path=server_audit.log,0
TIME,HOSTNAME,,,0,0,AUDIT_CONFIG,,rotate_size=1000000,0
TIME,HOSTNAME,,,0,0,AUDIT_CONFIG,,file_rotations=9,0
TIME,HOSTNAME,root,localhost,ID,0,AUDIT_CONFIG,test,logging=ON,0
TIME,HOSTNAME,root,localhost,ID,0,AUDIT_CONFIG,test,reload_filters=ON,0
TIME,HOSTNAME,root,localhost,ID,ID,CREATE,d1,t1,
TIME,HOSTNAME,root,localhost,ID,ID,WRITE,d1,t1,
TIME,HOSTNAME,root,localhost,ID,ID,READ,mysql,table_stats,
TIME,HOSTNAME,root,localhost,ID,ID,READ,mysql,column_stats,
TIME,HOSTNAME,root,localhost,ID,ID,READ,mysql,index_stats,
TIME,HOSTNAME,root,localhost,ID,ID,READ,d1,t1,
TIME,HOSTNAME,root,localhost,ID,ID,WRITE,d1,t1,
TIME,HOSTNAME,root,localhost,ID,ID,WRITE,d1,t1,
TIME,HOSTNAME,root,localhost,ID,ID,ALTER,d1,t1,
TIME,HOSTNAME,root,localhost,ID,ID,READ,d1,t1,
TIME,HOSTNAME,root,localhost,ID,ID,RENAME,d1,t1|d1.t2,
TIME,HOSTNAME,root,localhost,ID,ID,WRITE,mysql,table_stats,
TIME,HOSTNAME,root,localhost,ID,ID,WRITE,mysql,column_stats,
TIME,HOSTNAME,root,localhost,ID,ID,WRITE,mysql,index_stats,
TIME,HOSTNAME,root,localhost,ID,ID,WRITE,mysql,table_stats,
TIME,HOSTNAME,root,localhost,ID,ID,WRITE,mysql,column_stats,
TIME,HOSTNAME,root,localhost,ID,ID,WRITE,mysql,index_stats,
TIME,HOSTNAME,root,localhost,ID,ID,DROP,d1,t2,
TIME,HOSTNAME,root,localhost,ID,ID,READ,mysql,proc,
TIME,HOSTNAME,root,localhost,ID,ID,WRITE,mysql,proc,
TIME,HOSTNAME,root,localhost,ID,ID,WRITE,mysql,event,
TIME,HOSTNAME,root,localhost,ID,ID,WRITE,mysql,db,
TIME,HOSTNAME,root,localhost,ID,ID,WRITE,mysql,tables_priv,
TIME,HOSTNAME,root,localhost,ID,ID,WRITE,mysql,columns_priv,
TIME,HOSTNAME,root,localhost,ID,ID,WRITE,mysql,procs_priv,
TIME,HOSTNAME,root,localhost,ID,ID,WRITE,mysql,proxies_priv,
TIME,HOSTNAME,root,localhost,ID,ID,WRITE,mysql,roles_mapping,
TIME,HOSTNAME,root,localhost,ID,ID,WRITE,mysql,global_priv,
TIME,HOSTNAME,root,localhost,ID,ID,WRITE,mysql,db,
TIME,HOSTNAME,root,localhost,ID,ID,WRITE,mysql,global_priv,
TIME,HOSTNAME,root,localhost,ID,ID,WRITE,mysql,global_priv,
TIME,HOSTNAME,root,localhost,ID,ID,WRITE,mysql,db,
TIME,HOSTNAME,root,localhost,ID,ID,WRITE,mysql,tables_priv,
TIME,HOSTNAME,root,localhost,ID,ID,WRITE,mysql,columns_priv,
TIME,HOSTNAME,root,localhost,ID,ID,WRITE,mysql,procs_priv,
TIME,HOSTNAME,root,localhost,ID,ID,WRITE,mysql,proxies_priv,
TIME,HOSTNAME,root,localhost,ID,ID,WRITE,mysql,roles_mapping,
TIME,HOSTNAME,root,localhost,ID,ID,WRITE,mysql,global_priv,
TIME,HOSTNAME,root,localhost,ID,ID,WRITE,mysql,server_audit_users,
TIME,HOSTNAME,root,localhost,ID,0,AUDIT_CONFIG,,reload_filters=ON,0
TIME,HOSTNAME,root,localhost,ID,ID,READ,mysql,table_stats,
TIME,HOSTNAME,root,localhost,ID,ID,READ,mysql,column_stats,
TIME,HOSTNAME,root,localhost,ID,ID,READ,mysql,index_stats,
TIME,HOSTNAME,root,localhost,ID,ID,READ,d1,t1,
TIME,HOSTNAME,root,localhost,ID,ID,READ,d1,t1,
TIME,HOSTNAME,root,localhost,ID,ID,READ,mysql,proc,
TIME,HOSTNAME,root,localhost,ID,0,AUDIT_CONFIG,,reload_filters=ON,0
TIME,HOSTNAME,root,localhost,ID,ID,WRITE,d1,t1,
TIME,HOSTNAME,root,localhost,ID,ID,WRITE,d1,t1,
TIME,HOSTNAME,root,localhost,ID,ID,WRITE,d1,t1,
TIME,HOSTNAME,root,localhost,ID,ID,WRITE,mysql,table_stats,
TIME,HOSTNAME,root,localhost,ID,ID,WRITE,mysql,column_stats,
TIME,HOSTNAME,root,localhost,ID,ID,WRITE,mysql,index_stats,
TIME,HOSTNAME,root,localhost,ID,ID,WRITE,mysql,table_stats,
TIME,HOSTNAME,root,localhost,ID,ID,WRITE,mysql,column_stats,
TIME,HOSTNAME,root,localhost,ID,ID,WRITE,mysql,index_stats,
TIME,HOSTNAME,root,localhost,ID,ID,WRITE,mysql,proc,
TIME,HOSTNAME,root,localhost,ID,ID,WRITE,mysql,event,
TIME,HOSTNAME,root,localhost,ID,ID,WRITE,mysql,db,
TIME,HOSTNAME,root,localhost,ID,ID,WRITE,mysql,tables_priv,
TIME,HOSTNAME,root,localhost,ID,ID,WRITE,mysql,columns_priv,
TIME,HOSTNAME,root,localhost,ID,ID,WRITE,mysql,procs_priv,
TIME,HOSTNAME,root,localhost,ID,ID,WRITE,mysql,proxies_priv,
TIME,HOSTNAME,root,localhost,ID,ID,WRITE,mysql,roles_mapping,
TIME,HOSTNAME,root,localhost,ID,ID,WRITE,mysql,global_priv,
TIME,HOSTNAME,root,localhost,ID,ID,WRITE,mysql,db,
TIME,HOSTNAME,root,localhost,ID,ID,WRITE,mysql,global_priv,
TIME,HOSTNAME,root,localhost,ID,ID,WRITE,mysql,global_priv,
TIME,HOSTNAME,root,localhost,ID,ID,WRITE,mysql,db,
TIME,HOSTNAME,root,localhost,ID,ID,WRITE,mysql,tables_priv,
TIME,HOSTNAME,root,localhost,ID,ID,WRITE,mysql,columns_priv,
TIME,HOSTNAME,root,localhost,ID,ID,WRITE,mysql,procs_priv,
TIME,HOSTNAME,root,localhost,ID,ID,WRITE,mysql,proxies_priv,
TIME,HOSTNAME,root,localhost,ID,ID,WRITE,mysql,roles_mapping,
TIME,HOSTNAME,root,localhost,ID,ID,WRITE,mysql,global_priv,
TIME,HOSTNAME,root,localhost,ID,ID,WRITE,mysql,server_audit_users,
TIME,HOSTNAME,root,localhost,ID,0,AUDIT_CONFIG,,reload_filters=ON,0
TIME,HOSTNAME,root,localhost,ID,ID,CREATE,d1,t1,
TIME,HOSTNAME,root,localhost,ID,0,AUDIT_CONFIG,,reload_filters=ON,0
TIME,HOSTNAME,root,localhost,ID,ID,ALTER,d1,t1,
TIME,HOSTNAME,root,localhost,ID,0,AUDIT_CONFIG,,reload_filters=ON,0
TIME,HOSTNAME,root,localhost,ID,ID,RENAME,d1,t1|d1.t2,
TIME,HOSTNAME,root,localhost,ID,0,AUDIT_CONFIG,,reload_filters=ON,0
TIME,HOSTNAME,root,localhost,ID,ID,DROP,d1,t2,
TIME,HOSTNAME,root,localhost,ID,0,AUDIT_CONFIG,,reload_filters=ON,0
TIME,HOSTNAME,root,localhost,ID,ID,CREATE,d1,t1,
TIME,HOSTNAME,root,localhost,ID,ID,WRITE,d1,t1,
TIME,HOSTNAME,root,localhost,ID,ID,WRITE,d1,t1,
TIME,HOSTNAME,root,localhost,ID,ID,WRITE,d1,t1,
TIME,HOSTNAME,root,localhost,ID,ID,WRITE,mysql,table_stats,
TIME,HOSTNAME,root,localhost,ID,ID,WRITE,mysql,column_stats,
TIME,HOSTNAME,root,localhost,ID,ID,WRITE,mysql,index_stats,
TIME,HOSTNAME,root,localhost,ID,ID,WRITE,mysql,table_stats,
TIME,HOSTNAME,root,localhost,ID,ID,WRITE,mysql,column_stats,
TIME,HOSTNAME,root,localhost,ID,ID,WRITE,mysql,index_stats,
TIME,HOSTNAME,root,localhost,ID,ID,WRITE,mysql,proc,
TIME,HOSTNAME,root,localhost,ID,ID,WRITE,mysql,event,
TIME,HOSTNAME,root,localhost,ID,ID,WRITE,mysql,db,
TIME,HOSTNAME,root,localhost,ID,ID,WRITE,mysql,tables_priv,
TIME,HOSTNAME,root,localhost,ID,ID,WRITE,mysql,columns_priv,
TIME,HOSTNAME,root,localhost,ID,ID,WRITE,mysql,procs_priv,
TIME,HOSTNAME,root,localhost,ID,ID,WRITE,mysql,proxies_priv,
TIME,HOSTNAME,root,localhost,ID,ID,WRITE,mysql,roles_mapping,
TIME,HOSTNAME,root,localhost,ID,ID,WRITE,mysql,global_priv,
TIME,HOSTNAME,root,localhost,ID,ID,WRITE,mysql,db,
TIME,HOSTNAME,root,localhost,ID,ID,WRITE,mysql,global_priv,
TIME,HOSTNAME,root,localhost,ID,ID,WRITE,mysql,global_priv,
TIME,HOSTNAME,root,localhost,ID,ID,WRITE,mysql,db,
TIME,HOSTNAME,root,localhost,ID,ID,WRITE,mysql,tables_priv,
TIME,HOSTNAME,root,localhost,ID,ID,WRITE,mysql,columns_priv,
TIME,HOSTNAME,root,localhost,ID,ID,WRITE,mysql,procs_priv,
TIME,HOSTNAME,root,localhost,ID,ID,WRITE,mysql,proxies_priv,
TIME,HOSTNAME,root,localhost,ID,ID,WRITE,mysql,roles_mapping,
TIME,HOSTNAME,root,localhost,ID,ID,WRITE,mysql,global_priv,
TIME,HOSTNAME,root,localhost,ID,ID,WRITE,mysql,plugin,
